{
  "overlay_version": "0.2.0",
  "language": "ko",
  "document_id": "ich_m10",
  "entries": [
    {
      "record_id": "ich_m10.cond.1_1.001",
      "record_type": "condition",
      "source_text_sha256": "9c8e0c923a469ef6b3dcadbc1c1d95fe5f2715498a703308ae98d939dcac00a9",
      "normalized_ko": "적절한 과학적 근거가 제시되는 경우",
      "normalization_status": "reviewed"
    },
    {
      "record_id": "ich_m10.cond.1_2.001",
      "record_type": "condition",
      "source_text_sha256": "5af3e7d46a6ca2b7308182df40c8344ca1ef84e2e32c0e8c3a0f5a349da59331",
      "normalized_ko": "유효한 경우",
      "normalization_status": "reviewed"
    },
    {
      "record_id": "ich_m10.cond.1_3.001",
      "record_type": "condition",
      "source_text_sha256": "5d0b2c98543fe00477af7fd6495d264ebd266eb0014c58dbf738acfc705d0fcd",
      "normalized_ko": "규제 승인 हेतु 제출되지 않거나 안전성, 유효성 또는 표시와 관련한 규제 결정에 고려되지 않는 연구의 경우",
      "normalization_status": "reviewed"
    },
    {
      "record_id": "ich_m10.cond.1_3.002",
      "record_type": "condition",
      "source_text_sha256": "6b8b0a7d3264992df94c009d1ada623f0cf2766cc6ae8004435680c83b2edc90",
      "normalized_ko": "우수실험실관리기준(GLP) 또는 우수임상시험관리기준(GCP)의 적용을 받는 연구의 경우",
      "normalization_status": "reviewed"
    },
    {
      "record_id": "ich_m10.cond.1_3.003",
      "record_type": "condition",
      "source_text_sha256": "9cd1d3fac0fe0e7f386dec6a7b979a36444cdfb55d32b828310da0a6ecbdb36d",
      "normalized_ko": "규제 결정을 뒷받침할 것으로 예상되는",
      "normalization_status": "reviewed"
    },
    {
      "record_id": "ich_m10.cond.1_3.004",
      "record_type": "condition",
      "source_text_sha256": "6ff734e6fd7c99a658c47e54ad77b8f1c857eaaa7c816154a57ae8e9e6509658",
      "normalized_ko": "규제 제출자료에서, GLP 원칙에 따라 수행된 비임상 독성동태학(TK) 연구, 임상시험의 대리로 수행된 비임상 약동학(PK) 연구 및 비교 생체이용률/생물학적동등성(BA/BE) 연구를 포함한 임상시험의 모든 단계에서 얻어진",
      "normalization_status": "reviewed"
    },
    {
      "record_id": "ich_m10.cond.1_3.005",
      "record_type": "condition",
      "source_text_sha256": "30caebbcc50193e7581485231d665b4269178cda5dea0c72de22322e1f4e1dab",
      "normalized_ko": "규제 제출을 뒷받침하기 위한",
      "normalization_status": "reviewed"
    },
    {
      "record_id": "ich_m10.cond.1_3.006",
      "record_type": "condition",
      "source_text_sha256": "f11aa14273b10cbe660d41629f2ad8252f4d12a864c6049021206254f7004603",
      "normalized_ko": "필요에 따라",
      "normalization_status": "reviewed"
    },
    {
      "record_id": "ich_m10.cond.1_3.007",
      "record_type": "condition",
      "source_text_sha256": "9cd1d3fac0fe0e7f386dec6a7b979a36444cdfb55d32b828310da0a6ecbdb36d",
      "normalized_ko": "규제 결정을 뒷받침할 것으로 예상되는",
      "normalization_status": "reviewed"
    },
    {
      "record_id": "ich_m10.cond.1_3.008",
      "record_type": "condition",
      "source_text_sha256": "6ff734e6fd7c99a658c47e54ad77b8f1c857eaaa7c816154a57ae8e9e6509658",
      "normalized_ko": "규제 제출자료에서, GLP 원칙에 따라 수행된 비임상 독성동태학(TK) 연구, 임상시험의 대리로 수행된 비임상 약동학(PK) 연구 및 비교 생체이용률/생물학적동등성(BA/BE) 연구를 포함한 임상시험의 모든 단계에서 얻어진",
      "normalization_status": "reviewed"
    },
    {
      "record_id": "ich_m10.cond.1_3.009",
      "record_type": "condition",
      "source_text_sha256": "30caebbcc50193e7581485231d665b4269178cda5dea0c72de22322e1f4e1dab",
      "normalized_ko": "규제 제출을 뒷받침하기 위한",
      "normalization_status": "reviewed"
    },
    {
      "record_id": "ich_m10.cond.2_1.001",
      "record_type": "condition",
      "source_text_sha256": "071fb0bd8f63e1ea113e3eb7bcc2edf3eaeb14fb98cba8fcf4261f5448959af9",
      "normalized_ko": "생체분석법 개발 전 또는 개발 중",
      "normalization_status": "reviewed"
    },
    {
      "record_id": "ich_m10.cond.2_1.002",
      "record_type": "condition",
      "source_text_sha256": "f867665c4426f49e92111dd934bc7448595b9d9557afad7564a563cdf5856b15",
      "normalized_ko": "실행 가능한 경우",
      "normalization_status": "reviewed"
    },
    {
      "record_id": "ich_m10.cond.2_1.003",
      "record_type": "condition",
      "source_text_sha256": "078555438db8fcd3d74c16e772f2a57b9e8dc919e5a9653ae9aafbbc142adf29",
      "normalized_ko": "비임상 또는 임상시험 검체 분석 중 분석을 중단해야 하는 방법상의 문제가 발생한 경우",
      "normalization_status": "reviewed"
    },
    {
      "record_id": "ich_m10.cond.2_1.004",
      "record_type": "condition",
      "source_text_sha256": "071fb0bd8f63e1ea113e3eb7bcc2edf3eaeb14fb98cba8fcf4261f5448959af9",
      "normalized_ko": "생체분석법 개발 전 또는 개발 중",
      "normalization_status": "reviewed"
    },
    {
      "record_id": "ich_m10.cond.2_1.005",
      "record_type": "condition",
      "source_text_sha256": "39dcf52b863c1338fc988e91ea74f5beaac2ab8fde3ef6b41d010009c199bac9",
      "normalized_ko": "의도된 목적을 위해",
      "normalization_status": "reviewed"
    },
    {
      "record_id": "ich_m10.cond.2_2_1.001",
      "record_type": "condition",
      "source_text_sha256": "5fe45fcccd5951427b91d729e181695bd1f409b7269b83ccc297bfa444dd3830",
      "normalized_ko": "임상 및 해당되는 비임상 시험에서 분석물질을 정량하기 위한 생체분석법을 확립하는 경우",
      "normalization_status": "reviewed"
    },
    {
      "record_id": "ich_m10.cond.2_2_1.002",
      "record_type": "condition",
      "source_text_sha256": "ec46b30a1b29865f3d80ac933b7555ab75f629bc58ee87772eb3074c19cace97",
      "normalized_ko": "문헌에 보고된 분석법을 도입하는 경우",
      "normalization_status": "reviewed"
    },
    {
      "record_id": "ich_m10.cond.2_2_1.003",
      "record_type": "condition",
      "source_text_sha256": "4809b8b061deb11440c3cf8bcabe1ed1dde87ee3dd409566de77222ee97d3b52",
      "normalized_ko": "상업용 키트를 의약품 개발에서 생체분석 용도로 재활용하는 경우",
      "normalization_status": "reviewed"
    },
    {
      "record_id": "ich_m10.cond.2_2_1.004",
      "record_type": "condition",
      "source_text_sha256": "ec46b30a1b29865f3d80ac933b7555ab75f629bc58ee87772eb3074c19cace97",
      "normalized_ko": "문헌에 보고된 분석법을 도입하는 경우",
      "normalization_status": "reviewed"
    },
    {
      "record_id": "ich_m10.cond.2_2_1.005",
      "record_type": "condition",
      "source_text_sha256": "4809b8b061deb11440c3cf8bcabe1ed1dde87ee3dd409566de77222ee97d3b52",
      "normalized_ko": "상업용 키트를 의약품 개발에서 생체분석 용도로 재활용하는 경우",
      "normalization_status": "reviewed"
    },
    {
      "record_id": "ich_m10.cond.2_2_1.006",
      "record_type": "condition",
      "source_text_sha256": "3d86d16b303e64c73420cc2c6cf9ba306fa59bf06ef88aba2dd9bc7ebb899045",
      "normalized_ko": "크로마토그래피 방법의 경우",
      "normalization_status": "reviewed"
    },
    {
      "record_id": "ich_m10.cond.2_2_1.007",
      "record_type": "condition",
      "source_text_sha256": "7356fccd2010c409ecace1363dfec4f42f4c68c50a30355d289e472ee74e7a2c",
      "normalized_ko": "LBA의 경우",
      "normalization_status": "reviewed"
    },
    {
      "record_id": "ich_m10.cond.2_2_1.008",
      "record_type": "condition",
      "source_text_sha256": "d6562cc25f7b14112cd661b008786702c64bbe048cbeb2227d58b4dd0e06c363",
      "normalized_ko": "규제 제출을 뒷받침하도록 의도된 주 매트릭스의 경우",
      "normalization_status": "reviewed"
    },
    {
      "record_id": "ich_m10.cond.2_2_1.009",
      "record_type": "condition",
      "source_text_sha256": "30caebbcc50193e7581485231d665b4269178cda5dea0c72de22322e1f4e1dab",
      "normalized_ko": "규제 제출을 뒷받침하도록 의도된 경우",
      "normalization_status": "reviewed"
    },
    {
      "record_id": "ich_m10.cond.2_2_3.001",
      "record_type": "condition",
      "source_text_sha256": "917d24d6d8fdb790dfdd9a5e1550a92831562fe4e17121f214ff307fc81bcb6b",
      "normalized_ko": "여러 생체분석 방법 및/또는 여러 생체분석 실험실이 관여하는 경우",
      "normalization_status": "reviewed"
    },
    {
      "record_id": "ich_m10.cond.3_1.001",
      "record_type": "condition",
      "source_text_sha256": "e729da87bcf4a5c8f2e2052216dbfc6fd1012a2c0515ac80349598be189ab7d2",
      "normalized_ko": "다만, 원액의 정확한 조제 및 안정성이 검증되었어야 한다.",
      "normalization_status": "needs_review"
    },
    {
      "record_id": "ich_m10.cond.3_2_1.001",
      "record_type": "condition",
      "source_text_sha256": "2639bb55e9dc4c4522f51bbe603969ca6047fcda65cc4379f0120a4a3e300e5f",
      "normalized_ko": "또는 희귀 매트릭스의 경우 그보다 적은 수",
      "normalization_status": "reviewed"
    },
    {
      "record_id": "ich_m10.cond.3_2_1.002",
      "record_type": "condition",
      "source_text_sha256": "e277bb1601208b122431afa17bfef22318246aebc8dc041837ff03070068098e",
      "normalized_ko": "비극성 매트릭스의 경우",
      "normalization_status": "reviewed"
    },
    {
      "record_id": "ich_m10.cond.3_2_1.003",
      "record_type": "condition",
      "source_text_sha256": "fde60c0b318a10da2250806002b19957eb9d08f21368b75dc5e1bd86ed2e4bf1",
      "normalized_ko": "희귀 매트릭스의 경우",
      "normalization_status": "reviewed"
    },
    {
      "record_id": "ich_m10.cond.3_2_1.004",
      "record_type": "condition",
      "source_text_sha256": "e5d9e120ddf2f4018b10a43c53fae52c70476a5b369874594ca37ef34c959895",
      "normalized_ko": "비극성 매트릭스(예: 지질성, 지질혈증성)의 경우",
      "normalization_status": "reviewed"
    },
    {
      "record_id": "ich_m10.cond.3_2_2.001",
      "record_type": "condition",
      "source_text_sha256": "32d3af367068f7ca1d83e73c0f2126f288f97e3afefdd37811bb44aeabb19ca1",
      "normalized_ko": "방법이 분석물질을 관련 물질과 구별할 수 없는 경우",
      "normalization_status": "reviewed"
    },
    {
      "record_id": "ich_m10.cond.3_2_2.002",
      "record_type": "condition",
      "source_text_sha256": "3eb6710cb05da3024148a52ceb53d9cde35c5130123f795fe50755e2e17237ae",
      "normalized_ko": "잠재적 간섭 물질을 첨가한 공시료에서",
      "normalization_status": "reviewed"
    },
    {
      "record_id": "ich_m10.cond.3_2_2.003",
      "record_type": "condition",
      "source_text_sha256": "aae6d7b89ce79d85006a7035350acadcca84ee9bd3e15c69d2240e1d15396531",
      "normalized_ko": "연구 검체에서 예상되는 최고 농도에서",
      "normalization_status": "reviewed"
    },
    {
      "record_id": "ich_m10.cond.3_2_2.004",
      "record_type": "condition",
      "source_text_sha256": "3eb6710cb05da3024148a52ceb53d9cde35c5130123f795fe50755e2e17237ae",
      "normalized_ko": "잠재적 간섭 물질을 첨가한 공시료에서",